{
  "schema_version": 1,
  "case_id": "template-case",
  "status": "draft",
  "created_utc": "1970-01-01T00:00:00Z",
  "updated_utc": "1970-01-01T00:00:00Z",
  "decision_question": "",
  "target": {
    "name": "",
    "repository": "",
    "revision": "",
    "dependency_lock": "",
    "license": ""
  },
  "owners": {
    "decision": "",
    "evidence": "",
    "review": ""
  },
  "scope": {
    "included": [],
    "excluded": [],
    "assumptions": []
  },
  "claims": [],
  "invariants": [],
  "methods": [],
  "gates": [],
  "runs": [],
  "decisions": [],
  "artifacts": [],
  "final_disposition": "pending"
}

